,Opening,Opening.1,Title,Director,Cast,Studio (production house),Ref.
0,JAN,1.0,Ghost Stories,Karan JoharDibakar BanerjeeZoya AkhtarAnurag Kashyap,Sobhita DhulipalaMrunal ThakurAvinash TiwaryJanhvi KapoorSurekha SikriRaghuvir YadavGulshan DevaiahVijay VarmaPavail GulatiJyoti SubhashEva Ameet PardeshiKitu GidwaniSumit Tandon,"RSVP Movies, Flying Unicorn Entertainment, Netflix",[12]
1,JAN,3.0,Bhangra Paa Le,Sneha Taurani,Sunny KaushalRukshar DhillonShriya Pilgaonkar,RSVP Movies,[13]
2,JAN,3.0,Sab Kushal Mangal,Karan Vishwanath Kashyap,Akshaye KhannaRiva KishanPriyank Sharma,One Up Entertainment,[14]
3,JAN,3.0,Shimla Mirchi,Ramesh Sippy,Hema MaliniRajkummar RaoRakul Preet Singh,Viacom18 Motion Pictures,[15]
4,JAN,10.0,Chhapaak,Meghna Gulzar,Deepika PadukoneVikrant Massey,"Fox Star Studios, Ka Productions, Mriga Films",[16]
5,JAN,10.0,Tanhaji,Om Raut,Ajay DevgnSaif Ali KhanKajolSharad Kelkar,"Ajay Devgn FFilms, T-Series",[17]
6,JAN,17.0,Bunker,Jugal Raja,Abhijeet SinghArindita Kalita,Wagging Tail Entertainment,[18]
7,JAN,17.0,Jai Mummy Di,Navjot Gulati,Sunny SinghSonnalli SeygallPoonam DhillonSupriya Pathak,"Luv Films, T-Series",[19]
8,JAN,24.0,Panga,Ashwiny Iyer Tiwari,Kangana RanautJassi GillRicha ChadhaNeena Gupta,Fox Star Studios,[20]
9,JAN,24.0,Street Dancer 3D,Remo D'Souza,Varun DhawanShraddha KapoorPrabhu DevaNora FatehiAparshakti KhuranaMurali SharmaRaghav JuyalDharmesh YelandePunit PathakJigar RupareliyaSonam Bajwa,"T-Series, Remo D'Souza Entertainment",[21]
10,JAN,31.0,Gul Makai,H.E. Amjad khan,Reem ShaikhAtul KulkarniDivya DuttaOm PuriArif ZakariaMukesh RishiAbhimanyu SinghPankaj Tripathi,Pen India Limited,[22]
11,JAN,31.0,Happy Hardy and Heer,Raka,Himesh ReshammiyaSonia Mann,"HR Musik Limited, EYKA Films",[23]
12,JAN,31.0,Jawaani Jaaneman,Nitin Kakkar,Saif Ali KhanTabuAlaya Furniturewala,Pooja Entertainment,[24]
13,JAN,31.0,Pagleaazam,"Vikas P Kavvthekaar, Aps Raghuvanshi",Aditya Pratap SinghMandeep Kaur MannnatSonia SharmaLiliputFaruqueRavi MannAbhinaye SharmaSahil PatelAmber Upadhyay,Aps Entertainment,[25]
14,FEB,4.0,Operation Parindey,Sanjay Gadhvi,Amit SadhRahul DevAakash DahiyaRucha Inamdar,"Final Coast, Fluence Studios, Roll Kamera Motion Pictures, ZEE5",[26]
15,FEB,7.0,Hacked,Vikram Bhatt,Hina KhanRohan ShahMohit MalhotraSid Makkar,Zee Studios,[27]
16,FEB,7.0,Kaanchli Life in a Slough,Dedipya Joshii,Sanjay MishraShikha Malhotra,Pisceann Pictures,[28]
17,FEB,7.0,Malang,Mohit Suri,Aditya Roy KapurDisha PataniAnil KapoorElli AvrRamAmruta Khanvilkar,"T-Series, Luv Films",[29]
18,FEB,7.0,Shikara,Vidhu Vinod Chopra,Aadil KhanSadia Khateeb,"Vinod Chopra Films, Fox Star Studios",[30]
19,FEB,14.0,Love Aaj Kal,Imtiaz Ali,Kartik AaryanSara Ali KhanRandeep Hooda,"Jio Studios, Maddock Films, Reliance Entertainment, Window Seat Films",[31]
20,FEB,14.0,Shukranu,Bishnu Dev Halder,DivyennduShweta Basu PrasadSheetal Thakur,"Reliance Entertainment, ZEE5",[32]
21,FEB,21.0,Bhoot – Part One: The Haunted Ship,Bhanu Pratap Singh,Vicky KaushalBhumi Pednekar,Dharma Productions,[33]
22,FEB,21.0,The Hundred Bucks,Dushyant Pratap Singh,Kavita TripathiDinesh BawraJaid Shaikh,Dushyant Corporation,[34][35]
23,FEB,21.0,Shubh Mangal Zyada Saavdhan,Hitesh Kewalya,Ayushmann KhurranaJitendra KumarGajraj RaoNeena GuptaManurishi ChaddhaSunita RajwarMaanvi GagrooPankhuri AwasthyNeeraj Singh,"Colour Yellow Productions, T-Series",[36]
24,FEB,21.0,Yeh Ballet,Sooni Taraporevala,Julian SandsAchintya BoseManish Chauhan,"Roy Kapur Films, Netflix",[37]
25,FEB,28.0,Doordarshan,Gagan Puri,Mahie GillManu Rishi ChaddhaDolly AhluwaliaSupriya ShuklaRajesh SharmaMehak ManwaniSumit Gulati,"Arya Films, UFO Moviez",[38]
26,FEB,28.0,Guns of Banaras,Sekhar Suri,Karan NathNathalia KaurAbhimanyu SinghGanesh VenkatramanShilpa ShirodkarZarina WahabMohan AgasheTej Sapru,"AJ Media Corp, Dashaka Cinema Co Production",[39]
27,FEB,28.0,Haunted Hills,Sanjeev Kumar Rajput,Zuber K. KhanDiana Khan,"RSBS Films, UFO Moviez",[40]
28,FEB,28.0,O Pushpa I Hate Tears,Dinkar Kapoor,Krushna AbhishekKarthik JayaramArjumman Mughal,"Films@50, Wavelength Studios",[41]
29,FEB,28.0,Thappad,Anubhav Sinha,Taapsee PannuPavail GulatiMaya SaraoNaila Grewal,"Benaras Media Works, T-Series",[42]
30,MAR,2.0,Dheet Patangey,Ravi Adhikari,Shivin NarangChandan Roy SanyalAli MuradHardik SanghaniTillotama ShomePriya Banerjee,"Happi Digital,Hotstar",[43]
31,MAR,6.0,Baaghi 3,Ahmed Khan,Tiger ShroffRiteish DeshmukhShraddha KapoorAnkita Lokhande,"Nadiadwala Grandson Entertainment, Fox Star Studios",[44]
32,MAR,6.0,Guilty,Ruchi Narain,Kiara AdvaniAkansha Ranjan KapoorGurfateh Singh PirzadaTaher ShabbirDalip TahilKunal VijaykarManu RishiJanya JoshiChayan Chopra,"Dharmatic, Netflix",[45]
33,MAR,6.0,Kaamyaab,Hardik Mehta,Sanjay MishraDeepak Dobriyal,"Red Chillies Entertainment, Drishyam Films",[46]
34,MAR,13.0,Angrezi Medium,Homi Adajania,Irrfan KhanKareena KapoorRadhika MadanDeepak DobriyalPankaj Tripathi,Maddock Films,[47]
35,MAR,27.0,Maska,Neeraj Udhwani,Manisha KoiralaNikita DuttaJaved JaffreyPrit KamaniShirley Setia,"Mutant Films, Netflix",[48]
36,APR,10.0,Bamfaad,Ranjan Chandel,Aditya RawalShalini PandeyVijay Varma,"JAR Pictures, ZEE5",[51]
37,APR,21.0,Ateet,Tanuj Bhramar,PriyamaniSanjay SuriRajeev Khandelwal,"Funtime Entertainment, Indian Film Studios, ZEE5",[52]
38,MAY,1.0,Mrs. Serial Killer,Shirish Kunder,Jacqueline FernandezManoj BajpayeeMohit RainaZayn Marie,"Three's Company Productions Pvt.Ltd, Netflix",[53]
39,MAY,20.0,What Are the Odds,Megha Ramaswamy,Yashaswini DayamaKaranvir MalhotraAbhay Deol,"FilmKaravan, Netflix",[54]
40,MAY,22.0,Ghoomketu,Pushpendra Nath Misra,Nawazuddin SiddiquiRagini KhannaRicha ChadhaAnurag KashyapDeepika AminRaghuvir YadavIla ArunSwanand Kirkire,"Phantom Films, Sony Pictures, ZEE5",[55]
41,JUN,1.0,Chippa,Safdar Rehman,Sunny PawarJoyraj BhattacharyaSumeet ThakurGautam SarkarMasood AkhtarKalpan Mitra,"Traveling Light Pictures, Ultra Media & Entertainment, Victory Media, Wishberry Films",[56]
42,JUN,5.0,Chintu Ka Birthday,Devanshu KumarSatyanshu Singh,Vinay PathakTillotama ShomeNate Scholz,"Final Draft, ZEE5",[57]
43,JUN,5.0,Choked,Anurag Kashyap,Saiyami KherRoshan MathewAmruta SubhashRajshri Deshpande,"JAR Pictures, Good Bad Films, Netflix",[58]
44,JUN,12.0,Axone,Nicholas Kharkongor,Dolly AhluwaliaSayani GuptaTenzin DalhaVinay PathakLin LaishramAsenla JamirLanuakum Ao,"Saregama India, Yoodlee films",[59]
45,JUN,12.0,Gulabo Sitabo,Shoojit Sircar,Farrukh JaffarAmitabh BachchanAyushmann KhurranaVijay RaazBrijendra KalaNalneesh Neel,"Rising Sun Films, Kino Works, Prime Video",[60]
46,JUN,18.0,Kadakh,Rajat Kapoor,Kalki KoechlinRanvir ShoreyShruti SethManoj PahwaTara SharmaCyrus SahukarMansi Multani,"Mithya Talkies, Sony LIV",[61]
47,JUN,19.0,Chaman Bahaar,Apurva Dhar Badgaiyann,Jitendra KumarRitika Badiani,"Saregama India, Yoodlee films",[62]
48,JUN,24.0,Bulbbul,Anvita Dutt,Tripti DimriAvinash TiwaryRahul BoseParambrata ChatterjeePaoli Dam,"Clean Slate Films, Netflix",[63]
49,JUN,26.0,Bhonsle,Devashish Makhija,Manoj BajpayeeSantosh JuvekarIpshita Chakraborty SinghAbhishek Banerjee,"Muvizz, Sony LIV",[64]
50,JUN,27.0,Unlock,Debatma Mandal,Kushal TandonHina KhanRishabh SinhaAditi Arya,"Krasnaya Corporation, Wind Horse Films, ZEE5",[65]
51,JUL,16.0,Virgin Bhanupriya,Ajay Lohan,Urvashi RautelaGautam Gulati,"Dhariwal Films, ZEE5",[66]
52,JUL,24.0,Dil Bechara,Mukesh Chhabra,Sushant Singh RajputSanjana SanghiSaif Ali Khan,"Fox Star Studios, Disney+ Hotstar",[67]
53,JUL,30.0,Yaara,Tigmanshu Dhulia,Vidyut JammwalShruti HaasanAmit SadhVijay VarmaKenny Basumatary,"Tigmanshu Dhulia Films, Azure Entertainment, ZEE5",[68]
54,JUL,31.0,Shakuntala Devi,Anu Menon,Vidya BalanJisshu SenguptaSanya MalhotraAmit Sadh,"Abundantia Entertainment, Sony Pictures Networks India, A Genius Films Production, Prime Video",[69]
55,JUL,31.0,Lootcase,Rajesh Krishnan,Kunal KhemuRasika DugalVijay RaazRanvir ShoreyGajraj RaoAryan PrajapatiShashi RanjanSumit Nijhawan,"Fox Star Studios, Soda Films, Disney+ Hotstar",[70]
56,JUL,31.0,Raat Akeli Hai,Honey Trehan,Nawazuddin SiddiquiRadhika ApteShweta TripathiIla ArunShivani RaghuvanshiAditya SrivastavaTigmanshu DhuliaSwanand Kirkire,"RSVP Movies, Netflix",[71]
57,AUG,6.0,Pareeksha,Prakash Jha,Adil HussainPriyanka BoseSanjay Suri,"Prakash Jha Productions, ZEE5",[72]
58,AUG,12.0,Gunjan Saxena: The Kargil Girl,Sharan Sharma,Janhvi KapoorPankaj TripathiAngad BediVineet Kumar SinghManav Vij,"Dharma Productions, Zee Studios, Netflix",[73]
59,AUG,14.0,Khuda Haafiz,Faruk Kabir,Vidyut JammwalShivaleeka OberoiAnnu KapoorShiv PandittAahana Kumra,"Panorama Studios, Disney+ Hotstar",[74]
60,AUG,21.0,Mee Raqsam,Baba Azmi,Naseeruddin ShahDanish HusainAditi SubediShradha KaulRakesh Chaturvedi,"AZMI Pictures, ZEE5",[75]
61,AUG,21.0,Class of '83,Atul Sabharwal,Bobby DeolBhupendra JadawatHitesh BhojrajAnup SoniJoy SenguptaSameer ParanjapeNinad MahajaniPrithvik Pratap,"Red Chillies Entertainment, Netflix",[76]
62,AUG,28.0,Sadak 2,Mahesh Bhatt,Sanjay DuttPooja BhattAlia BhattAditya Roy Kapur,"Vishesh Films, Fox Star Studios, Disney+ Hotstar",[77]
63,AUG,28.0,Ram Singh Charlie,Nitin Kakkar,Kumud MishraDivya DuttaAkarsh KhuranaFarrukh SeyerSalima RazaRohit Rokhade,"Little Too Much Productions, Sony Liv",[78]
64,SEP,5.0,Atkan Chatkan,Shiv Hare,Sachin ChaudharyYash RaneTamanna Dipak,"Lokaa Entertainment, ZEE5",[79]
65,SEP,9.0,Cargo,Arati Kadav,Vikrant MasseyShweta Tripathi,"Fundamental Pictures, Electric Films, Netflix",[80]
66,SEP,11.0,Tiki Taka,Parambrata Chatterjee,Emona EnabuluParambrata ChattopadhyayRitabhari ChakrabortySaswata Chatterjee,"Ratanshree Nirman, Ten Films, Roadshow Films, ZEE5",[81]
67,SEP,18.0,Dolly Kitty Aur Woh Chamakte Sitare,Alankrita Shrivastava,Konkona Sen SharmaBhumi PednekarAmol ParasharAamir BashirKubbra SaitKaran KundraVikrant MasseyMushtaq Khan,"Balaji Motion Pictures, ALT Entertainment, Netflix",[82]
68,SEP,18.0,London Confidential,Kanwal Sethi,Mouni RoyPurab KohliKulraj RandhawaSagar AryaParvesh RanaJas BinagDiljohn SinghKiren Jog,"JAR Pictures, ZEE5",[83]
69,SEP,21.0,Halahal,Randeep Jha,Sachin KhedekarBarun Sobti,"Eros International, Eros Now",[84]
70,21,,,,,,
71,OCT,2.0,Khaali Peeli,Maqbool Khan,Ishaan KhatterAnanya PandayJaideep Ahlawat,"Zee Studios, Offside Entertainment, Zee Plex, ZEE5",[85]
72,OCT,2.0,Serious Men,Sudhir Mishra,Nawazuddin SiddiquiAakshath DasShweta Basu PrasadNassarIndira Tiwari,"Bombay Fables, Cineraas Entertainment, Netflix",[86]
73,OCT,2.0,Bahut Hua Samman,Ashish R Shukla,Raghav JuyalAbhishek ChauhanSanjay MishraRam KapoorNidhi SinghNamit DasFlora Saini,"Yoodlee films, Disney+ Hotstar",[87]
74,OCT,9.0,Ginny Weds Sunny,Puneet Khanna,Yami GautamVikrant Massey,"Soundrya Production, Netflix",[88]
75,OCT,21.0,Comedy Couple,Nachiket Samant,Saqib SaleemShweta Basu Prasad,"Yoodlee films, ZEE5",[89]
76,OCT,29.0,Taish,Bejoy Nambiar,Pulkit SamratKriti KharbandaJim SarbhHarshvardhan RaneAnkur RatheeZoa MoraniSanjeeda SheikhNeha SharmaAditya PancholiAmrita Puri,"Ease My Trip, Getaway Pictures Presentation, A Crayon Films Production, ZEE5",[90]
77,OCT,30.0,Kaali Khuhi,Terrie Samundra,Shabana AzmiSatyadeep MishraRiva AroraSanjeeda Sheikh,Netflix,[91]
78,NOV,9.0,Laxmmi Bomb,Raghava Lawrence,Akshay KumarKiara Advani,"Cape of Good Films, Fox Star Studios, Shabinaa Entertainment, Tushar Entertainment House, Disney+ Hotstar",[92]
79,NOV,12.0,Ludo,Anurag Basu,Abhishek BachchanRajkummar RaoAditya Roy KapurFatima Sana ShaikhSanya MalhotraPankaj TripathiRohit Suresh SarafPearle MaaneyAsha NegiInayat VermaShalini Vats,"T-Series, Anurag Basu Productions, Netflix",[93]
80,NOV,13.0,Namumkin Tere Bin Jeena,Hidayat Khan,Anmol ChopraChristeenaBiju Rehana Khan,"Trisha Raj Films Pvt.Ltd,Zaid Corporation Company,Shamshad Pathan Films",[94]
81,NOV,13.0,Chhalaang,Hansal Mehta,Rajkummar RaoNushrat Bharucha,"T-Series, Luv Films, Ajay Devgn FFilms, Amazon Prime Video",[95]
82,NOV,13.0,Suraj Pe Mangal Bhari,Abhishek Sharma,Manoj BajpayeeDiljit DosanjhFatima Sana Shaikh,"Zee Studios, Essel Vision Productions",[96]
83,NOV,20.0,Raat Baaki Hai,Avinash Das,Anup SoniPaoli DamRahul Dev,ZEE5,[97]
84,DEC,11.0,Durgavati,G. Ashok,Bhumi PednekarArshad Warsi,"Abundantia Entertainment, T-Series, Cape of Good Films, Amazon Prime Video",[95]
85,DEC,25.0,Coolie No. 1,David Dhawan,Varun DhawanSara Ali Khan,"Pooja Entertainment, Amazon Prime Video",[95]
